Book, Author, "Publisher/Collection", Cover
The Count of Monte Cristo, Alexandre Dumas, "Everyman's Library", Hardcover
Divine Comedy, Dante Alighieri, "Everyman's Library", Hardcover
The Brothers Karamazov, Fyodor Dostoevsky, "Everyman's Library", Hardcover
One Hundred Years of Solitude, Gabriel García Márquez, "Everyman's Library", Hardcover
"Catch-22", Joseph Heller, "Everyman's Library", Hardcover
"In Search of Lost Time: Volume 1", Marcel Proust, "Everyman's Library", Hardcover
The Iliad and the Odyssey, Homer, Fingerprint Deluxe Edition, Hardcover
Frankenstein, Mary Shelley, Fingerprint Deluxe Edition, Hardcover
