Book, Author, Type, Subject
The Feynman Lectures on Physics Vol. 1, "Feynman, Leighton, Sands", Nonfiction, Physics
Mastering C++, "K R Venugopal, R. Buyya", Textbook, Programming
The Elements of Coordinate Geometry, "S. L. Loney", Textbook, Mathematics
Plane Trigonometry, "S. L. Loney", Textbook, Mathematics
Calculus of One Variable, "I. A. Maron", Textbook, Mathematics
Basic Laws of Electromagnetism, "I. E. Irodov", Textbook, Mathematics
Higher Algebra, "Hall, Knight", Textbook, Mathematics
A Student's Guide to Maxwell's Equations, "Daniel A. Fleisch", Nonfiction, Physics
Einstein for Everyone, Robert L. Piccioni, Nonfiction, Science book
C++ Primer, "S. B. Lippman, J. Lajoie, B. E. Moo", Textbook, Programming
